{
  "$schema": "http://json-schema.org/draft-07/schema#",
  "$id": "tabledef-schema.json",
  "title": "Lithium Tabulator Table Definition Schema",
  "description": "Validates per-query/table column definition files. Each file defines how a specific query's result set maps to a Tabulator table, referencing coltypes for formatting.",
  "type": "object",
  "required": ["table", "title", "queryRef", "readonly", "columns"],
  "properties": {
    "$schema": { "type": "string" },
    "$version": { "type": "string" },
    "$description": { "type": "string" },

    "table": {
      "type": "string",
      "description": "Unique identifier for this table definition (kebab-case)"
    },
    "title": {
      "type": "string",
      "description": "Human-readable title displayed in the UI"
    },
    "queryRef": {
      "type": ["integer", "null"],
      "minimum": 1,
      "description": "Primary query reference number to fetch list data. null = client-built rows (no query)."
    },
    "searchQueryRef": {
      "type": "integer",
      "minimum": 1,
      "description": "Query reference number for search/filter operations (optional — falls back to queryRef with params)"
    },
    "detailQueryRef": {
      "type": "integer",
      "minimum": 1,
      "description": "Query reference number to fetch full row details on selection"
    },
    "insertQueryRef": {
      "type": "integer",
      "minimum": 1,
      "description": "Query reference number for inserting new rows"
    },
    "updateQueryRef": {
      "type": "integer",
      "minimum": 1,
      "description": "Query reference number for updating existing rows"
    },
    "deleteQueryRef": {
      "type": "integer",
      "minimum": 1,
      "description": "Query reference number for deleting rows"
    },
    "readonly": {
      "type": "boolean",
      "description": "When true, the entire table is read-only regardless of individual column settings"
    },
    "selectableRows": {
      "description": "Number of rows that can be selected simultaneously (1 for single, true for multi, false for none)",
      "oneOf": [
        { "type": "integer", "minimum": 0 },
        { "type": "boolean" }
      ]
    },
    "layout": {
      "type": "string",
      "enum": ["fitData", "fitDataFill", "fitDataStretch", "fitDataTable", "fitColumns"],
      "description": "Tabulator layout mode"
    },
    "responsiveLayout": {
      "type": "string",
      "enum": ["hide", "collapse"],
      "description": "How columns respond to narrow widths"
    },
    "resizableColumns": {
      "type": "boolean",
      "description": "Whether users can resize columns by dragging"
    },
    "persistSort": {
      "type": "boolean",
      "description": "Remember sort state across data reloads"
    },
    "persistFilter": {
      "type": "boolean",
      "description": "Remember filter state across data reloads"
    },
    "initialSort": {
      "type": "array",
      "description": "Default sort order when data is first loaded",
      "items": {
        "type": "object",
        "required": ["column", "dir"],
        "properties": {
          "column": { "type": "string" },
          "dir": { "type": "string", "enum": ["asc", "desc"] }
        }
      }
    },
    "groupBy": {
      "description": "Field name(s) to group rows by (string or array of strings). If not specified, groupBy is computed from column 'group' values.",
      "oneOf": [
        { "type": "string" },
        { "type": "array", "items": { "type": "string" } }
      ]
    },
    "groupStartOpen": {
      "description": "Whether groups start expanded (true), collapsed (false), or a function/array per Tabulator",
      "oneOf": [
        { "type": "boolean" },
        { "type": "array", "items": { "type": "boolean" } }
      ]
    },
    "groupToggleElement": {
      "type": "string",
      "enum": ["arrow", "header", "false"],
      "description": "Which part of the group header toggles open/closed"
    },
    "columnCalcs": {
      "type": "string",
      "enum": ["both", "table", "group"],
      "description": "Where column calculations are displayed"
    },

    "columns": {
      "type": "object",
      "description": "Column definitions keyed by field name from the query result",
      "additionalProperties": {
        "$ref": "#/definitions/column"
      }
    }
  },
  "additionalProperties": false,

  "definitions": {
    "column": {
      "type": "object",
      "required": ["title", "field", "coltype", "visible", "editable"],
      "properties": {
        "title": {
          "type": "string",
          "description": "Column header title displayed to the user"
        },
        "field": {
          "type": "string",
          "description": "Field name in the query result data (must match JSON key from API)"
        },
        "coltype": {
          "type": "string",
          "description": "Reference to a coltype defined in coltypes.json (e.g., 'integer', 'string', 'lookup')"
        },
        "visible": {
          "type": "boolean",
          "description": "Whether the column is visible by default (can be toggled via column chooser)"
        },
        "sort": {
          "type": "boolean",
          "description": "Whether the column is sortable"
        },
        "filter": {
          "type": "boolean",
          "description": "Whether the column has a header filter"
        },
        "group": {
          "description": "Group order for auto-computed grouping. Non-zero values enable grouping, sorted ascending. Boolean preserved for legacy compatibility (false = no grouping, true = group with order 1).",
          "anyOf": [
            { "type": "boolean" },
            { "type": "integer" },
            { "type": "number" }
          ]
        },
        "editable": {
          "type": "boolean",
          "description": "Whether the column is editable (subject to table-level readonly and permissions)"
        },
        "calculated": {
          "type": "boolean",
          "description": "Whether the value is server-calculated (computed columns, timestamps, etc.) — always non-editable"
        },
        "primaryKey": {
          "type": "boolean",
          "description": "Whether this field is the primary key (used for API update/delete operations)"
        },
        "description": {
          "type": "string",
          "description": "Developer documentation for this column"
        },
        "lookupRef": {
          "type": "string",
          "description": "For lookup coltypes: the lookup table reference (e.g., 'a27', 'a28')"
        },
        "hozAlign": {
          "type": "string",
          "enum": ["left", "center", "right"],
          "description": "Horizontal alignment of cell content"
        },
        "overrides": {
          "type": "object",
          "description": "[DEPRECATED] Use direct Tabulator properties instead. Kept for backward compatibility.",
          "additionalProperties": true
        }
      },
      "additionalProperties": true
    }
  }
}
