{
  "$schema": "../tabledef-schema.json",
  "$version": "1.0.0",
  "$description": "Column definitions for User Options from Lookup 060 (App UI Lists). Displays profile sections and user preferences.",
  "table": "user-options",
  "title": "User Options",
  "queryRef": 26,
  "readonly": true,
  "selectableRows": 1,
  "layout": "fitColumns",
  "responsiveLayout": "collapse",
  "resizableColumns": true,
  "persistSort": false,
  "persistFilter": false,
  "columns": {
    "key_idx": {
      "title": "ID#",
      "field": "key_idx",
      "coltype": "index",
      "visible": false,
      "sort": true,
      "filter": true,
      "editable": false,
      "calculated": false,
      "primaryKey": true,
      "description": "Database primary key \u2014 hidden from display",
      "bottomCalc": null
    },
    "index": {
      "title": "Index",
      "field": "index",
      "coltype": "integer",
      "visible": false,
      "sort": true,
      "filter": true,
      "editable": false,
      "calculated": false,
      "primaryKey": false,
      "description": "Section index for page selection \u2014 hidden from display"
    },
    "section": {
      "title": "Section",
      "field": "section",
      "coltype": "string",
      "visible": false,
      "sort": true,
      "filter": true,
      "editable": false,
      "calculated": true,
      "primaryKey": false,
      "description": "Group/section the option belongs to",
      "width": 120,
      "groupable": true,
      "groupPri": 1,
      "groupDir": "asc"
    },
    "icon": {
      "title": "<fa fa-wrench></fa>",
      "field": "icon",
      "coltype": "string",
      "visible": true,
      "sort": false,
      "filter": false,
      "editable": false,
      "calculated": true,
      "primaryKey": false,
      "description": "Icon for the option",
      "width": 30,
      "formatter": "html",
      "hozAlign": "center",
      "bottomCalc": "count",
      "minWidth": 24
    },
    "label": {
      "title": "Page",
      "field": "label",
      "coltype": "string",
      "visible": true,
      "sort": true,
      "filter": true,
      "editable": false,
      "calculated": true,
      "primaryKey": false,
      "description": "Page name"
    },
    "status": {
      "title": "Status",
      "field": "status_a1",
      "coltype": "lookup",
      "visible": false,
      "sort": false,
      "filter": false,
      "editable": false,
      "calculated": false,
      "primaryKey": false,
      "description": "Active/Inactive status",
      "lookupRef": "a1"
    }
  },
  "groupStartOpen": false,
  "columnCalcs": "table"
}
